{
  "workerUrl" : "http://localhost:8082",
  "workerThreads" : 3,
  "tsdbConnection" : {
    "tsdbType" : "INFLUX",
    "url" : "http://127.0.0.1:8086",
    "token" : "YcqeMSEqzrvDsPevnsPA9fuES38RU-R9_y9UZ2gefEYaNJfVdUOVdj5NvrPpwNnmVuGoZSsqZ_jxnKx9dhdHYw==",
    "connectionProperties" : {
      "bucketName" : "testbucket",
      "organisationName" : "testorg"
    }
  },
  "createStorage" : true,
  "cleanupStorage" : true
}